{
  "repo_name": "bynote.api",
  "repo_full_name": "bynaki/bynote.api",
  "repo_owner": "bynaki",
  "repo_description": "byNote API",
  "repo_private": false,
  "repo_fork": false,
  "schemas": [
    {
      "name": "query.graphql",
      "path": "src/schema/typedefs/query.graphql",
      "sha": "100174179868b0db0b1ee743354a6c92913f80df",
      "url": "https://api.github.com/repositories/82260118/contents/src/schema/typedefs/query.graphql?ref=142cfa45cf9d868e71c9b0e1a69cb39c022e3fdf",
      "git_url": "https://api.github.com/repositories/82260118/git/blobs/100174179868b0db0b1ee743354a6c92913f80df",
      "html_url": "https://github.com/bynaki/bynote.api/blob/142cfa45cf9d868e71c9b0e1a69cb39c022e3fdf/src/schema/typedefs/query.graphql",
      "content": "type Query {\n  # this is echo()\n  echo (\n    # this is message\n    message: String!\n  ): String\n\n  # 내 프로필\n  getProfile: Profile\n\n  docset: DocsetQuery\n}\n",
      "containsQueryType": true,
      "merged": {
        "mergedContent": "# https://github.com/bynaki/bynote.api/blob/142cfa45cf9d868e71c9b0e1a69cb39c022e3fdf/src/schema/typedefs/query.graphql:\ntype Query {\n  # this is echo()\n  echo (\n    # this is message\n    message: String!\n  ): String\n\n  # 내 프로필\n  getProfile: Profile\n\n  docset: DocsetQuery\n}\n\n# https://github.com/bynaki/bynote.api/blob/142cfa45cf9d868e71c9b0e1a69cb39c022e3fdf/src/schema/typedefs/type.graphql:\n# 프로필\ntype Profile {\n  name: String\n  email: String\n  url: String\n  bio: String\n}\n\ninput ProfileInput {\n  name: String\n  email: String\n  url: String\n  bio: String\n}\n\n\ntype DocsetInfoPlist {\n  CFBundleIdentifier: String\n  CFBundleName: String\n  DocSetPlatformFamily: String\n  isDashDocset: Boolean\n  DashDocSetKeyword: String\n}\n\ntype DocsetFeedWithUrl {\n  version: String\n  ios_version: String\n  urls: [String]\n  other_versions: [String]\n  feed_url: String\n}\n\nenum DocsetScope {\n  OfficialDocset\n  PublicNote\n  PrivateNote\n}\n\ntype DocsetInfo {\n  name: String\n  keyword: String\n  scope: DocsetScope\n  info: DocsetInfoPlist\n  feed: DocsetFeedWithUrl\n}\n\ninput FindOption {\n  fuzzy: Boolean\n  limit: Int\n  keyword: String\n  scope: String\n}\n\ntype FindResult {\n  id: String\n  name: String\n  type: String\n  path: String\n  keyword: String\n  scope: DocsetScope\n}\n\ntype DocsetQuery {\n  officialFeedUrlList: [String]\n  list(\n    scope: DocsetScope\n  ): [DocsetInfo]\n  find(\n    name: String!\n    option: FindOption\n  ): [FindResult]\n}\n\ntype DocsetMutation {\n  download(\n    feed_url: String!\n  ): Boolean\n  delete(\n    keyword: String!\n  ): Boolean\n}\n\n\n# # 노트 제목 정보\n# type Headline {\n#   uuid: String\n#   level: Int\n#   hash: String\n#   headline: String\n#   fullHeadline: String\n#   content: String\n# }\n\n# # 저장할 노트 정보\n# input NoteInput {\n#   uuid: String!\n#   content: String\n#   tags: [String]\n#   origin: String\n# }\n\n# # image hash\n# type ImageHash {\n#   key: String\n#   value: String\n# }\n\n# # 노트 정보\n# type NoteOutput {\n#   uuid: String\n#   content: String\n#   tags: [String]\n#   origin: String\n#   url: String\n#   heads: [Headline]\n#   images: [ImageHash]\n#   created_at: String\n#   updated_at: String\n# }",
        "mergedPaths": [
          "src/schema/typedefs/type.graphql"
        ],
        "typesDefinedByMerge": [
          "Profile",
          "DocsetQuery"
        ],
        "directivesDefinedByMerge": [],
        "validSchema": true,
        "contentDuplicate": false,
        "numObjectTypes": 8,
        "containsCycle": false,
        "polynomialLevel": 1,
        "numDefinitions": 11
      },
      "validSchema": false
    },
    {
      "name": "type.graphql",
      "path": "src/schema/typedefs/type.graphql",
      "sha": "f220b1cfbd8fb41bb3cd05554f38350e8a4f3bfb",
      "url": "https://api.github.com/repositories/82260118/contents/src/schema/typedefs/type.graphql?ref=142cfa45cf9d868e71c9b0e1a69cb39c022e3fdf",
      "git_url": "https://api.github.com/repositories/82260118/git/blobs/f220b1cfbd8fb41bb3cd05554f38350e8a4f3bfb",
      "html_url": "https://github.com/bynaki/bynote.api/blob/142cfa45cf9d868e71c9b0e1a69cb39c022e3fdf/src/schema/typedefs/type.graphql",
      "content": "# 프로필\ntype Profile {\n  name: String\n  email: String\n  url: String\n  bio: String\n}\n\ninput ProfileInput {\n  name: String\n  email: String\n  url: String\n  bio: String\n}\n\n\ntype DocsetInfoPlist {\n  CFBundleIdentifier: String\n  CFBundleName: String\n  DocSetPlatformFamily: String\n  isDashDocset: Boolean\n  DashDocSetKeyword: String\n}\n\ntype DocsetFeedWithUrl {\n  version: String\n  ios_version: String\n  urls: [String]\n  other_versions: [String]\n  feed_url: String\n}\n\nenum DocsetScope {\n  OfficialDocset\n  PublicNote\n  PrivateNote\n}\n\ntype DocsetInfo {\n  name: String\n  keyword: String\n  scope: DocsetScope\n  info: DocsetInfoPlist\n  feed: DocsetFeedWithUrl\n}\n\ninput FindOption {\n  fuzzy: Boolean\n  limit: Int\n  keyword: String\n  scope: String\n}\n\ntype FindResult {\n  id: String\n  name: String\n  type: String\n  path: String\n  keyword: String\n  scope: DocsetScope\n}\n\ntype DocsetQuery {\n  officialFeedUrlList: [String]\n  list(\n    scope: DocsetScope\n  ): [DocsetInfo]\n  find(\n    name: String!\n    option: FindOption\n  ): [FindResult]\n}\n\ntype DocsetMutation {\n  download(\n    feed_url: String!\n  ): Boolean\n  delete(\n    keyword: String!\n  ): Boolean\n}\n\n\n# # 노트 제목 정보\n# type Headline {\n#   uuid: String\n#   level: Int\n#   hash: String\n#   headline: String\n#   fullHeadline: String\n#   content: String\n# }\n\n# # 저장할 노트 정보\n# input NoteInput {\n#   uuid: String!\n#   content: String\n#   tags: [String]\n#   origin: String\n# }\n\n# # image hash\n# type ImageHash {\n#   key: String\n#   value: String\n# }\n\n# # 노트 정보\n# type NoteOutput {\n#   uuid: String\n#   content: String\n#   tags: [String]\n#   origin: String\n#   url: String\n#   heads: [Headline]\n#   images: [ImageHash]\n#   created_at: String\n#   updated_at: String\n# }",
      "containsQueryType": false,
      "validSchema": true,
      "contentDuplicate": false,
      "numDefinitions": 10
    }
  ],
  "metrics": {
    "created_at": "2017-02-17T05:19:35Z",
    "updated_at": "2017-02-17T05:20:21Z",
    "pushed_at": "2017-06-29T02:21:20Z",
    "issues": 0,
    "watchers": 1,
    "fork_count": 0,
    "has_wiki_enabled": true,
    "license": "mit",
    "pull_requests": 0,
    "pull_requests_open": 0,
    "pull_requests_closed": 0,
    "pull_requests_merged": 0,
    "releases": 0,
    "stargazers": 0
  }
}