{
  "repo_name": "nuber-server",
  "repo_full_name": "smc0210/nuber-server",
  "repo_owner": "smc0210",
  "repo_description": "node.js toyProject",
  "repo_private": false,
  "repo_fork": false,
  "schemas": [
    {
      "name": "schema.graphql",
      "path": "src/schema.graphql",
      "sha": "726f7ec2ac3589db483c1ba3382ca56b94f07052",
      "url": "https://api.github.com/repositories/144539634/contents/src/schema.graphql?ref=4b00e08579f84f5c6b01b7abca7f8d3696632707",
      "git_url": "https://api.github.com/repositories/144539634/git/blobs/726f7ec2ac3589db483c1ba3382ca56b94f07052",
      "html_url": "https://github.com/smc0210/nuber-server/blob/4b00e08579f84f5c6b01b7abca7f8d3696632707/src/schema.graphql",
      "content": "type Chat {\n  id: Int!\n  messages: [Message]!\n  participants: [User]!\n  createdAt: String!\n  updatedAt: String\n}\n\ntype Message {\n  id: Int!\n  text: String!\n  chat: Chat!\n  user: User!\n  createdAt: String!\n  updatedAt: String\n}\n\ntype Place {\n  id: Int!\n  name: String!\n  lat: Float!\n  lng: Float!\n  address: String!\n  isFav: Boolean!\n  createdAt: String!\n  updatedAt: String\n}\n\ntype Ride {\n  id: Int!\n  status: String!\n  pickUpAddress: String!\n  pickUpLat: Float!\n  pickUpLng: Float!\n  dropOffAddress: String!\n  dropOffLat: Float!\n  dropOffLng: Float!\n  price: Float!\n  distance: String!\n  duration: String!\n  driver: User!\n  passenger: User!\n  createdAt: String!\n  updatedAt: String\n}\n\ntype EmailSignInResponse {\n  ok: Boolean!\n  error: String\n  token: String\n}\n\ntype Mutation {\n  EmailSignIn(email: String!, password: String!): EmailSignInResponse!\n  FacebookConnect(firstName: String!, lastName: String!, email: String, fbId: String!): FacebookConnectResponse!\n  StartPhoneVerification(phoneNumber: String!): StartPhoneVerificationResponse!\n}\n\ntype FacebookConnectResponse {\n  ok: Boolean!\n  error: String\n  token: String\n}\n\ntype User {\n  id: Int!\n  email: String\n  verifiedEmail: Boolean!\n  firstName: String!\n  lastName: String!\n  age: Int\n  password: String\n  phoneNumber: String\n  verifiedPhonenNumber: Boolean!\n  profilePhoto: String\n  fullName: String\n  isDriving: Boolean!\n  isRiding: Boolean!\n  isTaken: Boolean!\n  lastLng: Float\n  lastLat: Float\n  lastOrientation: Float\n  fbId: String\n  chat: Chat\n  messages: [Message]\n  ridesAsPassenger: [Ride]\n  ridesAsDriver: [Ride]\n  createdAt: String!\n  updatedAt: String\n}\n\ntype Query {\n  user: User\n}\n\ntype StartPhoneVerificationResponse {\n  ok: Boolean!\n  error: String\n}\n\ntype Verification {\n  id: Int!\n  target: String!\n  payload: String!\n  key: String!\n  createdAt: String!\n  updatedAt: String!\n}\n",
      "containsQueryType": true,
      "validSchema": true,
      "contentDuplicate": false,
      "numObjectTypes": 11,
      "containsCycle": true,
      "numDefinitions": 11
    },
    {
      "name": "User.graphql",
      "path": "src/api/User/shared/User.graphql",
      "sha": "7f3713e00cb51bdc27989487d3d57b94b19bd0a3",
      "url": "https://api.github.com/repositories/144539634/contents/src/api/User/shared/User.graphql?ref=4b00e08579f84f5c6b01b7abca7f8d3696632707",
      "git_url": "https://api.github.com/repositories/144539634/git/blobs/7f3713e00cb51bdc27989487d3d57b94b19bd0a3",
      "html_url": "https://github.com/smc0210/nuber-server/blob/4b00e08579f84f5c6b01b7abca7f8d3696632707/src/api/User/shared/User.graphql",
      "content": "type User {\n    id: Int!\n    email: String\n    verifiedEmail: Boolean!\n    firstName: String!\n    lastName: String!\n    age: Int\n    password: String\n    phoneNumber: String\n    verifiedPhonenNumber: Boolean!\n    profilePhoto: String    \n    fullName: String\n    isDriving: Boolean!\n    isRiding: Boolean!\n    isTaken: Boolean!\n    lastLng: Float\n    lastLat: Float\n    lastOrientation: Float\n    fbId: String\n    chat: Chat\n    messages: [Message]\n    ridesAsPassenger: [Ride]\n    ridesAsDriver: [Ride]\n    createdAt: String!\n    updatedAt: String\n}\n\ntype Query {\n    user: User\n}",
      "containsQueryType": true,
      "merged": {
        "mergedContent": "# https://github.com/smc0210/nuber-server/blob/4b00e08579f84f5c6b01b7abca7f8d3696632707/src/api/User/shared/User.graphql:\ntype User {\n    id: Int!\n    email: String\n    verifiedEmail: Boolean!\n    firstName: String!\n    lastName: String!\n    age: Int\n    password: String\n    phoneNumber: String\n    verifiedPhonenNumber: Boolean!\n    profilePhoto: String    \n    fullName: String\n    isDriving: Boolean!\n    isRiding: Boolean!\n    isTaken: Boolean!\n    lastLng: Float\n    lastLat: Float\n    lastOrientation: Float\n    fbId: String\n    chat: Chat\n    messages: [Message]\n    ridesAsPassenger: [Ride]\n    ridesAsDriver: [Ride]\n    createdAt: String!\n    updatedAt: String\n}\n\ntype Query {\n    user: User\n}\n# https://github.com/smc0210/nuber-server/blob/cebcc178e85c48fa069db6a1d5da274fd220d171/src/api/Chat/shared/Chat.graphql:\ntype Chat {\n    id: Int!\n    messages: [Message]!\n    participants: [User]!\n    createdAt: String!\n    updatedAt: String\n}\n# https://github.com/smc0210/nuber-server/blob/cebcc178e85c48fa069db6a1d5da274fd220d171/src/api/Chat/shared/Message.graphql:\ntype Message {\n    id: Int!\n    text: String!\n    chat: Chat!\n    user: User!\n    createdAt: String!\n    updatedAt: String\n}\n# https://github.com/smc0210/nuber-server/blob/13d84205cd0551f7061c572399fe76629c3770b6/src/api/Ride/shared/Ride.graphql:\ntype Ride {\n    id: Int!\n    status: String!\n    pickUpAddress: String!\n    pickUpLat: Float!\n    pickUpLng: Float!\n    dropOffAddress: String!\n    dropOffLat: Float!\n    dropOffLng: Float!\n    price: Float!\n    distance: String!\n    duration: String!\n    driver: User!\n    passenger: User!\n    createdAt: String!\n    updatedAt: String\n}",
        "mergedPaths": [
          "src/api/Chat/shared/Chat.graphql",
          "src/api/Chat/shared/Message.graphql",
          "src/api/Ride/shared/Ride.graphql"
        ],
        "typesDefinedByMerge": [
          "Chat",
          "Message",
          "Ride"
        ],
        "directivesDefinedByMerge": [],
        "validSchema": true,
        "contentDuplicate": true,
        "numDefinitions": 5
      },
      "validSchema": false
    },
    {
      "name": "Chat.graphql",
      "path": "src/api/Chat/shared/Chat.graphql",
      "sha": "c0b5354dc13eb1ed16bf80d21f4b1ece084da1c7",
      "url": "https://api.github.com/repositories/144539634/contents/src/api/Chat/shared/Chat.graphql?ref=cebcc178e85c48fa069db6a1d5da274fd220d171",
      "git_url": "https://api.github.com/repositories/144539634/git/blobs/c0b5354dc13eb1ed16bf80d21f4b1ece084da1c7",
      "html_url": "https://github.com/smc0210/nuber-server/blob/cebcc178e85c48fa069db6a1d5da274fd220d171/src/api/Chat/shared/Chat.graphql",
      "content": "type Chat {\n    id: Int!\n    messages: [Message]!\n    participants: [User]!\n    createdAt: String!\n    updatedAt: String\n}",
      "containsQueryType": false,
      "validSchema": false,
      "numDefinitions": 1
    },
    {
      "name": "Message.graphql",
      "path": "src/api/Chat/shared/Message.graphql",
      "sha": "08c045ba3cfb85b8759505dca22b8cf94f4f05e3",
      "url": "https://api.github.com/repositories/144539634/contents/src/api/Chat/shared/Message.graphql?ref=cebcc178e85c48fa069db6a1d5da274fd220d171",
      "git_url": "https://api.github.com/repositories/144539634/git/blobs/08c045ba3cfb85b8759505dca22b8cf94f4f05e3",
      "html_url": "https://github.com/smc0210/nuber-server/blob/cebcc178e85c48fa069db6a1d5da274fd220d171/src/api/Chat/shared/Message.graphql",
      "content": "type Message {\n    id: Int!\n    text: String!\n    chat: Chat!\n    user: User!\n    createdAt: String!\n    updatedAt: String\n}",
      "containsQueryType": false,
      "validSchema": false,
      "numDefinitions": 1
    },
    {
      "name": "Ride.graphql",
      "path": "src/api/Ride/shared/Ride.graphql",
      "sha": "141a71a7f98a6db2a9290971e8c9d24559c18c3b",
      "url": "https://api.github.com/repositories/144539634/contents/src/api/Ride/shared/Ride.graphql?ref=13d84205cd0551f7061c572399fe76629c3770b6",
      "git_url": "https://api.github.com/repositories/144539634/git/blobs/141a71a7f98a6db2a9290971e8c9d24559c18c3b",
      "html_url": "https://github.com/smc0210/nuber-server/blob/13d84205cd0551f7061c572399fe76629c3770b6/src/api/Ride/shared/Ride.graphql",
      "content": "type Ride {\n    id: Int!\n    status: String!\n    pickUpAddress: String!\n    pickUpLat: Float!\n    pickUpLng: Float!\n    dropOffAddress: String!\n    dropOffLat: Float!\n    dropOffLng: Float!\n    price: Float!\n    distance: String!\n    duration: String!\n    driver: User!\n    passenger: User!\n    createdAt: String!\n    updatedAt: String\n}",
      "containsQueryType": false,
      "validSchema": false,
      "numDefinitions": 1
    }
  ],
  "metrics": {
    "created_at": "2018-08-13T06:42:40Z",
    "updated_at": "2018-12-01T16:00:05Z",
    "pushed_at": "2018-12-01T16:00:03Z",
    "issues": 0,
    "watchers": 1,
    "fork_count": 0,
    "has_wiki_enabled": true,
    "license": "mit",
    "pull_requests": 0,
    "pull_requests_open": 0,
    "pull_requests_closed": 0,
    "pull_requests_merged": 0,
    "releases": 0,
    "stargazers": 0
  }
}